<?xml version="1.0" encoding="UTF-8"?>
<?xml-stylesheet title="Dictionary view" media="screen,tv,projection" href="../../scripts/gt_dictionary.css" type="text/css"?>
<?xml-stylesheet alternate="yes" title="Hierarchical view" media="screen,tv,projection" href="../../scripts/gt_dictionary_alt.css" type="text/css"?>
<!DOCTYPE r
  PUBLIC "-//DivvunGiellatekno//DTD Dictionaries//Multilingual" "../scripts/dictionary.dtd">
<r id="sjd2x" xml:lang="sjd">
    <lics xml:space="preserve">
 <lic xml:lang="en">
This code is made available under a Creative Commons Attribution license
<a>http://creativecommons.org/licenses/by/3.0/no/deed.en</a>.

You are free to copy, distribute and adapt the work, as long as you always give
proper attribution using the attribution text below.

For the full license text, see the link above.</lic>
 <ref>Work by Giellatekno at UiT – Norges Arktiske Universitet, University of Freiburg, and members of the Kildin Saami language community. Source code available at <a>https://victorio.uit.no/langtech/trunk/</a>.</ref>
 <sourcenote>
 THIS TEXT IS THE ORIGINAL SOURCE CODE. This is NOT a fully styled and
 published dictionary. As such it can and
 will contain unfinished entries, unpublished entries, entries with
 objectionable translations, etc. If you find any errors or want to add more
 words, download the file, edit it, and send it back to
 <a>mailto:divvun@samediggi.no</a> or <a>mailto:giellatekno@hum.uit.no</a>.
 Please also note that the entries are not necessarily sorted,
 or could be wrongly sorted.
 </sourcenote>
 </lics>

    <e>
        <lg>
            <l pos="N" orth="1985kuru">ба̄йна</l>
            <orthography>
                <lvar orth="1986kert">ба̄йна</lvar>
                <lvar orth="1986ker1">байна</lvar>
            </orthography>
        </lg>
        <mg>
            <semantics>
                <sem class="xxx"/>
            </semantics>
            <tg>
                <t>баня</t>
            </tg>
            <xg>
                <x orth="1985kuru" pos="V">ба̄йнасьт лоавкнэдтэ</x>
                <xt>мыться в бане</xt>
            </xg>
            <xg>
                <x orth="1985kuru" pos="V">ба̄йнасьт поаррдэдтэ</x>
                <xt>париться в бане</xt>
            </xg>
            <xg>
                <x orth="1985kuru" pos="V">вӯллькэ ба̄йная</x>
                <xt>пойти в баню</xt>
            </xg>
            <xg>
                <x orth="1985kuru" pos="xxx" type="idiom">вӯзьхэ ба̄йна ке̄з-не</x>
                <xt>задать баню кому-либо</xt>
            </xg>
        </mg>
    </e>
    <e>
        <lg>
            <l pos="N" orth="1986kert">ба̄јјк</l>
            <orthography>
                <lvar orth="1986kert">ба̄йхьк</lvar>
            </orthography>
            <stem>xxx</stem>
        </lg>
        <mg>
            <tg xml:lang="rus">
                <t pos="N">работа</t>
            </tg>
        </mg>
        <mg>
            <tg xml:lang="rus">
                <t pos="N">сказка</t>
            </tg>
        </mg>
        <mg>
            <tg xml:lang="rus">
                <t pos="N">басня</t>
            </tg>
        </mg>
    </e>
</r>
